{"$schema":"https://json-schema.org/draft/2020-12/schema","$id":"vss.movie.existing_media_current_shot_binding/1","type":"object","additionalProperties":false,"required":["schema_version","contract_identity","contract_version","binding_status","revalidation_id","revalidation_sha256","media_sha256","project_id","scene_id","shot_id","frame_id","option_id","current_lineage","human_review_sha256","authority","limitations","binding_sha256"],"properties":{"schema_version":{"const":"1"},"contract_identity":{"const":"existing_media_current_shot_binding"},"contract_version":{"const":"1"},"binding_status":{"const":"sealed_current_visual_basis_reference_only"},"revalidation_id":{"type":"string","pattern":"^media-revalidation-[0-9a-f]{32}$"},"revalidation_sha256":{"$ref":"#/$defs/digest"},"media_sha256":{"$ref":"#/$defs/digest"},"project_id":{"$ref":"#/$defs/id"},"scene_id":{"$ref":"#/$defs/id"},"shot_id":{"type":"string","pattern":"^shot-[0-9a-f]{24}$"},"frame_id":{"type":"string","pattern":"^frame-[0-9a-f]{24}$"},"option_id":{"type":"string","pattern":"^option-[0-9a-f]{24}$"},"current_lineage":{"$ref":"#/$defs/lineage"},"human_review_sha256":{"$ref":"#/$defs/digest"},"authority":{"type":"object","additionalProperties":false,"properties":{"canon":{"const":false},"publication":{"const":false},"production":{"const":false},"runtime":{"const":false},"provider":{"const":false},"deployment":{"const":false},"regeneration":{"const":false},"workflow_activation":{"const":false}},"required":["canon","publication","production","runtime","provider","deployment","regeneration","workflow_activation"]},"limitations":{"type":"array","const":["current_lineage_reference_only","revalidation_review_required","historical_lineage_not_rewritten","not_production_or_generation_authority","not_provider_or_runtime_authority","not_publication_export_scheduling_or_workflow_authority","not_canon_or_rights_authority"]},"binding_sha256":{"$ref":"#/$defs/digest"}},"$defs":{"digest":{"type":"string","pattern":"^[0-9a-f]{64}$"},"id":{"type":"string","pattern":"^[a-z][a-z0-9._:-]{2,127}$"},"lineage":{"type":"object","additionalProperties":false,"required":["story_fragment","scene_breakdown","production_option_set","review_packet","review_decision","creative_decision_revision","canon_snapshot","production_canon_binding","shot_plan_draft","storyboard_specification","storyboard_frame"],"properties":{"story_fragment":{"$ref":"#/$defs/digest"},"scene_breakdown":{"$ref":"#/$defs/digest"},"production_option_set":{"$ref":"#/$defs/digest"},"review_packet":{"$ref":"#/$defs/digest"},"review_decision":{"$ref":"#/$defs/digest"},"creative_decision_revision":{"$ref":"#/$defs/digest"},"canon_snapshot":{"$ref":"#/$defs/digest"},"production_canon_binding":{"$ref":"#/$defs/digest"},"shot_plan_draft":{"$ref":"#/$defs/digest"},"storyboard_specification":{"$ref":"#/$defs/digest"},"storyboard_frame":{"$ref":"#/$defs/digest"}}}}}
